"443MHLZQ","journalArticle","2022","Zhu, Yin; Zhang, Jihua; Qian, Qizhu; Li, Yapeng; Li, Ziyun; Liu, Yi; Xiao, Chong; Zhang, Genqiang; Xie, Yi","Dual Nanoislands on Ni/C Hybrid Nanosheet Activate Superior Hydrazine Oxidation‐Assisted High‐Efficiency H<sub>2</sub> Production","Angewandte Chemie","","0044-8249, 1521-3757","10.1002/ange.202113082","https://onlinelibrary.wiley.com/doi/10.1002/ange.202113082","Abstract                            Clean hydrogen evolution through electrochemical water splitting underpins various innovative approaches to the pursuit of sustainable energy conversion technologies, but it is blocked by the sluggish anodic oxygen evolution reaction (OER). The hydrazine oxidation reaction (HzOR) has been considered as one of the most promising substitute for OER to improve the efficiency of hydrogen evolution reaction (HER). Herein, we construct novel dual nanoislands on Ni/C hybrid nanosheet array: one kind of island represents the part of bare Ni particle surface, while the other stands for the part of core–shell Ni@C structure (denoted as Ni‐C HNSA), in which exposed Ni atoms and Ni‐decorated carbon shell perform as active sites for HzOR and HER respectively. As a result, when the current density reaches 10 mA cm               −2               , the working potentials are merely −37 mV for HER and ‐20 mV for HzOR. A two‐electrode electrolyzer exhibits superb activity that only requires an ultrasmall cell voltage of 0.14 V to achieve 50 mA cm               −2               .","2022-01-10","2026-01-07 13:07:00","2026-01-07 13:07:00","2026-01-07 13:07:00","e202113082","","2","134","","Angewandte Chemie","","","","","","","","en","","","","","DOI.org (Crossref)","","","","C:\Users\Administrator\Zotero\storage\C8MJF2FX\Zhu 等 - 2022 - Dual Nanoislands on NiC Hybrid Nanosheet Activate Superior Hydrazine Oxidation‐Assisted High‐Effici.pdf","","","","","","","","","","","","","","","","","","","","","","","","","","","","","","","","","","","","","","","","","","","","","","","","",""
"4JD8YEXF","journalArticle","2022","Li, Jiachen; Li, Yang; Wang, Jiaao; Zhang, Chi; Ma, Huijun; Zhu, Chenhui; Fan, Daidi; Guo, Zhaoqi; Xu, Ming; Wang, Yaoyu; Ma, Haixia","Elucidating the Critical Role of Ruthenium Single Atom Sites in Water Dissociation and Dehydrogenation Behaviors for Robust Hydrazine Oxidation‐Boosted Alkaline Hydrogen Evolution","Advanced Functional Materials","","1616-301X, 1616-3028","10.1002/adfm.202109439","https://advanced.onlinelibrary.wiley.com/doi/10.1002/adfm.202109439","Abstract                            Hydrazine oxidation (HzOR)‐assisted overall water splitting (OWS) provides a unique approach to energy‐efficient hydrogen production (HER). However, there are still major challenges in the design of bifunctional catalysts and gain deep insight into the mechanism of both water dissociation and dehydrogenation kinetics triggered by the same active species during HzOR‐assisted OWS. Here, ruthenium single atoms (Ru SAs) anchored onto sulphur‐vacancies of tungsten disulphide (WS               2               ) are prepared by a sulfidation and facile galvanostatic deposition strategy. The WS               2               /Ru SAs act as a bifunctional catalyst and outperforms commercial platinum (Pt) catalysts for both HzOR and HER. Ultralow potentials of −74 and −32.1 mV at 10 mA cm               −2               are achieved for HzOR and HER, respectively. Two‐electrode electrolyzer using WS               2               /Ru SAs as both anode and cathode reaches 10 mA cm               −2               with cell voltage of only 15.4 mV, which is far below that of most electrocatalysts including commercial Pt. Density functional theory calculations unravel the critical role of Ru SAs in WS               2               , where the sluggish dissociation of water in HER can be promoted on Ru sites, and the sulfur sites of WS               2               exhibit a more thermoneutral behavior for hydrogen intermediate adsorption. Moreover, Ru sites are also active centers for stepwise hydrazine dehydrogenation during HzOR.","2022-04","2026-01-07 13:07:09","2026-01-07 13:07:09","2026-01-07 13:07:09","2109439","","16","32","","Adv Funct Materials","","","","","","","","en","","","","","DOI.org (Crossref)","","","","C:\Users\Administrator\Zotero\storage\U34MIBHQ\Li 等 - 2022 - Elucidating the Critical Role of Ruthenium Single Atom Sites in Water Dissociation and Dehydrogenati.pdf","","","","","","","","","","","","","","","","","","","","","","","","","","","","","","","","","","","","","","","","","","","","","","","","",""
"ANFUQEUS","journalArticle","2025","Huang, Junlin; Jin, Minghao; Zhang, Hao; Wang, Wei; Li, Aojie; Zhu, Yucan; Zhang, Jing; Yin, Hong; Xu, Wenyuan; Zhou, Minjie","Manipulating the d‐Band Center of Ir by Metal‐Support Interaction to Optimize the Adsorption for Self‐Powered Hydrazine Oxidation‐Assisted Hydrogen Generation","ENERGY & ENVIRONMENTAL MATERIALS","","2575-0356, 2575-0356","10.1002/eem2.70159","https://onlinelibrary.wiley.com/doi/10.1002/eem2.70159","The hydrazine oxidation‐assisted hydrogen generation system significantly expands the applicability of hydrogen production technology. However, the complex intermediate transformations involved in the hydrazine oxidation reaction (HzOR) and hydrogen evolution reaction (HER) desperately need the development of dual‐functional catalysts. Manipulating the d‐band center of metal catalysts has been identified as one of the most effective approaches to enhance catalytic activity. Herein, Ir nanoparticles (NPs) anchored in B, N‐codoped porous carbon (Ir@BNC) were developed and demonstrate excellent performances for both HER and HzOR in an alkaline medium, achieving 10 mA cm               −2               at −25 and 18 mV, respectively. The overall hydrazine splitting (OHzS) electrolyzer reaches 200 mA cm               −2               with a cell voltage of just 0.68 V. The direct liquid N               2               H               4               /H               2               O               2               fuel cell (DHHPFC) assembly with Ir@BNC can achieve a maximum power density of 199.2 mW cm               −2               at room temperature. Furthermore, an H               2               production system using an OHzS device powered by DHHPFC realizes hydrogen production at a stable rate (53.08 mol h               −1                m               −2               ). In‐situ Raman tests and theoretical calculations unravel the metal‐support interaction between Ir NPs and B, N‐codoped porous carbon, optimizing the electronic structure and regulating the d‐band center of Ir, reducing the adsorption energy of H* intermediates and N               2               H               4               molecules, thus promoting the reaction processes of HER and HzOR.","2025-09-10","2026-01-07 13:07:17","2026-01-07 13:07:17","2026-01-07 13:07:17","e70159","","","","","Energy &amp; Environ Materials","","","","","","","","en","","","","","DOI.org (Crossref)","","","","C:\Users\Administrator\Zotero\storage\M8WGEBGN\Huang 等 - 2025 - Manipulating the d‐Band Center of Ir by Metal‐Support Interaction to Optimize the Adsorption for Sel.pdf","","","","","","","","","","","","","","","","","","","","","","","","","","","","","","","","","","","","","","","","","","","","","","","","",""
"D4K5M7VQ","journalArticle","2008","Ojani, Reza; Raoof, Jahan‐Bakhsh; Norouzi, Banafsheh","Acetylferrocene Modified Carbon Paste Electrode; A Sensor for Electrocatalytic Determination of Hydrazine","Electroanalysis","","1040-0397, 1521-4109","10.1002/elan.200704187","https://analyticalsciencejournals.onlinelibrary.wiley.com/doi/10.1002/elan.200704187","Abstract                            The electrocatalytic oxidation of hydrazine at a carbon paste electrode spiked with acetylferrocene as a mediator was studied by cyclic voltammetry, differential pulse voltammetry, and chronoamperometry. In contrast to other ferrocenic compounds, acetylferrocene exhibits a chemical irreversible behavior, but it can act as an effective mediator for electrocatalytic oxidation of hydrazine, too. The heterogeneous electron transfer rate constant between acetylferrocene and the electrode substrate (carbon paste) and the diffusion coefficient of spiked acetylferrocene in silicon oil were estimated to be about 3.45×10               −4                cm s               −1               and 4.45×10               −9                cm               2               s               −1               , respectively. It has been found that under the optimum conditions (pH 7.5) the oxidation of hydrazine occurs at a potential of about 228 mV less positive than that of an unmodified carbon paste electrode. The catalytic oxidation peak current of hydrazine was linearly dependent on its concentration and the obtained linear range was 3.09×10               −5                M–1.03×10               −3                M. The detection limit (2               σ               ) has been determined as 2.7×10               −5                M by cyclic voltammetry. Also, the peak current was increased linearly with the concentration of hydrazine in the range of 1×10               −5                M–1×10               −3                M by differential pulse voltammetry with a detection limit of 1×10               −5                M. This catalytic oxidation of hydrazine has been applied as a selective, simple, and precise new method for the determination of hydrazine in water samples.","2008-06","2026-01-07 13:07:26","2026-01-07 13:07:26","2026-01-07 13:07:26","1378-1382","","12","20","","Electroanalysis","","","","","","","","en","","","","","DOI.org (Crossref)","","","","C:\Users\Administrator\Zotero\storage\HXWGQJGI\Ojani 等 - 2008 - Acetylferrocene Modified Carbon Paste Electrode; A Sensor for Electrocatalytic Determination of Hydr.pdf","","","","","","","","","","","","","","","","","","","","","","","","","","","","","","","","","","","","","","","","","","","","","","","","",""
"KI75Z6X4","journalArticle","2014","Maringa, Audacity; Nyokong, Tebello","Behavior of Palladium Nanoparticles in the Absence or Presence of Cobalt Tetraaminophthalocyanine for the Electrooxidation of Hydrazine","Electroanalysis","","1040-0397, 1521-4109","10.1002/elan.201400028","https://analyticalsciencejournals.onlinelibrary.wiley.com/doi/10.1002/elan.201400028","Abstract                            We report on the electrodeposition of palladium nanoparticles (PdNPs) on a glassy carbon electrode (GCE) and onto a poly‐CoTAPc‐GCE (CoTAPc=cobalt tetraamino phthalocyanine) surface. The electrodes are denoted as PdNPs‐GCE and PdNPs/poly‐CoTAPc‐GCE, respectively. PdNPs/poly‐CoTAPc‐GCE showed the best activity for the oxidation of hydrazine at the lowest potential of −0.28 V and with the highest currents. The results were further supported by electrochemical impedance spectroscopy (EIS) which showed that there was less resistance to charge transfer for PdNPs/poly‐CoTAPc‐GCE compared to PdNPs‐GCE. The catalytic rate constant for hydrazine oxidation was 6.12×10               8                cm               3                mol               −1                s               −1               using PdNPs/poly‐CoTAPc‐GCE.","2014-05","2026-01-07 13:07:30","2026-01-07 13:07:30","2026-01-07 13:07:30","1068-1077","","5","26","","Electroanalysis","","","","","","","","en","","","","","DOI.org (Crossref)","","","","C:\Users\Administrator\Zotero\storage\4VTW7XXH\Maringa和Nyokong - 2014 - Behavior of Palladium Nanoparticles in the Absence or Presence of Cobalt Tetraaminophthalocyanine fo.pdf","","","","","","","","","","","","","","","","","","","","","","","","","","","","","","","","","","","","","","","","","","","","","","","","",""
"W4Z9CHGI","journalArticle","2024","Behera, Snehanjali; Chauhan, Chetansinh; Mondal, Biswajit","Co–N–C/C Bifunctional Electrocatalyst for Dual Applications in Seawater Electrolysis and Catalyst in Hydrazine Fuel Cells","Small","","1613-6810, 1613-6829","10.1002/smll.202311946","https://onlinelibrary.wiley.com/doi/10.1002/smll.202311946","Abstract                            The convergence of water electrolysis and alkaline fuel cells offers captivating solutions for sustainably harvesting energy. The research explores both hydrazine‐assisted seawater electrolysis (hydrazine oxidation reaction (HzOR) and hydrogen production reaction (HER)), as well as alkaline hydrazine fuel cell reactions (HzOR and Oxygen reduction reaction (ORR)) by using a bifunctional cobalt polyaniline derived (Co PANI/C) catalyst. The catalyst shows excellent performance for hydrazine‐assisted seawater electrolysis in harsh seawater environments to produce H               2               as fuel with nearly 85% Faradaic efficiency and during alkaline HzOR, the bifunctional catalyst generates H               2               with 95% Faradaic efficiency by acting as both anode and cathode side catalyst. Also, the same catalyst requires only a potential of 0.34 V versus RHE and 0.906 V versus RHE for HzOR and ORR, respectively, in 1                m               KOH, which makes this overall process useful for a Hz/O               2               fuel cell.","2024-08","2026-01-07 13:07:36","2026-01-07 13:07:36","2026-01-07 13:07:36","2311946","","31","20","","Small","","","","","","","","en","","","","","DOI.org (Crossref)","","","","C:\Users\Administrator\Zotero\storage\7Z9VSI8P\Behera 等 - 2024 - Co–N–CC Bifunctional Electrocatalyst for Dual Applications in Seawater Electrolysis and Catalyst in.pdf","","","","","","","","","","","","","","","","","","","","","","","","","","","","","","","","","","","","","","","","","","","","","","","","",""
"XV9KAE9G","journalArticle","2011","Barathi, Palani; Senthil Kumar, Annamalai; Karthick, Minnal Ranjan Babu","Polynuclear Nickel Hexacyanoferrate/Graphitized Mesoporous Carbon Hybrid Chemically Modified Electrode for Selective Hydrazine Detection","International Journal of Electrochemistry","","2090-3537","10.4061/2011/386023","http://www.hindawi.com/journals/ijelc/2011/386023/","A hybrid polynuclear nickel hexacyanoferrate (NiHCFe)/graphitized mesoporous carbon- (GMC-) modified glassy carbon electrode (GCE/NiHCFe@GMC) has been prepared by a sequential method using electrodeposited Ni on a GMC-modified glassy carbon electrode (GCE/Ni@GMC) as a template and [Fe(CN)               6               ]               3−               as an               in-situ               chemical precipitant, without any additional interlinking agent. Physicochemical and electrochemical characterizations reveal the presence of NiHCFe units within the porous sites of the GMC. The GCE/NiHCFe@GMC electrode showed highly stable and well-defined redox behaviors with surface-confined electron-transfer mechanism in a pH 7 phosphate buffer solution. The GCE/NiHCFe@GMC showed about 20 times enhancement in hydrazine oxidation peak current along with 500 mV reduction in overpotential over the corresponding unmodified GCE/GMC. Hydrazine calibration plots by CV and amperometric               i-t               methods were linear up to 1 mM and 220                μ               M with current sensitivity values of 15.86                μ               A/mM and 7.37 nA/               μ               M, respectively. Calculated detection limit by the amperometric               i-t               method was 23.2 nM. The hybrid GCE/NiHCFe@GMC exhibits remarkable tolerance to important industrial and biological interferents. Finally determination of hydrazine in cigarette smoke sample was successfully demonstrated.","2011","2026-01-07 13:07:44","2026-01-07 13:07:44","2026-01-07 13:07:44","1-12","","","2011","","International Journal of Electrochemistry","","","","","","","","en","http://creativecommons.org/licenses/by/3.0/","","","","DOI.org (Crossref)","","","","C:\Users\Administrator\Zotero\storage\4EVWHAK9\Barathi 等 - 2011 - Polynuclear Nickel HexacyanoferrateGraphitized Mesoporous Carbon Hybrid Chemically Modified Electro.pdf","","","","","","","","","","","","","","","","","","","","","","","","","","","","","","","","","","","","","","","","","","","","","","","","",""
"579HCUAP","journalArticle","2018","Amin, Hatem M. A.; El‐Kady, Maher F.; Atta, Nada F.; Galal, Ahmed","Gold Nanoparticles Decorated Graphene as a High Performance Sensor for Determination of Trace Hydrazine Levels in Water","Electroanalysis","","1040-0397, 1521-4109","10.1002/elan.201800125","https://analyticalsciencejournals.onlinelibrary.wiley.com/doi/10.1002/elan.201800125","Abstract             Electrochemical sensors provide a selective, sensitive and an easy approach to detect hazardous substances such as hydrazine. Herein, we investigate a facile route for the fabrication of a nanostructured composite based on Au nanoparticles (AuNPs) decorated graphene and present its sensing performance towards hydrazine. Our strategy involves electrophoretic deposition (EPD) of graphene oxide (GO) on Au substrate to obtain a uniform layer EPD‐GO, followed by electrochemical reduction of GO to yield high quality graphene ERGO and electrodeposition of monodispersed AuNPs on ERGO (AuNPs/ERGO/Au). The modified AuNPs/ERGO/Au electrode was characterized using scanning electron microscopy (SEM) and Fourier transform infrared spectroscopy (FT‐IR) techniques. The sensor exhibited an improved catalytic activity with a peak potential of +87 mV (vs. Ag/AgCl) for hydrazine oxidation. The high performance of this hybrid electrode is due to the presence of a synergistic effect between AuNPs and ERGO at their interface. Insights into the mechanism and kinetics of hydrazine oxidation are withdrawn from varying the voltage scan rate as the reaction is fully irreversible and diffusion‐controlled. The proposed hydrazine sensor showed suitability for nanomolar detection (detection limit of 74 nM), high selectivity in the presence of common ions and efficiency for application in water samples.","2018-08","2026-01-07 13:08:07","2026-01-07 13:08:07","2026-01-07 13:08:07","1757-1766","","8","30","","Electroanalysis","","","","","","","","en","","","","","DOI.org (Crossref)","","","","C:\Users\Administrator\Zotero\storage\URTE64H6\Amin 等 - 2018 - Gold Nanoparticles Decorated Graphene as a High Performance Sensor for Determination of Trace Hydraz.pdf","","","","","","","","","","","","","","","","","","","","","","","","","","","","","","","","","","","","","","","","","","","","","","","","",""
"9CZ84LYB","journalArticle","2017","Wu, Lin‐Song; Dai, Hong‐Bin; Wen, Xiao‐Ping; Wang, Ping","Ni−Zn Alloy Nanosheets Arrayed on Nickel Foamas a Promising Catalyst for Electrooxidation of Hydrazine","ChemElectroChem","","2196-0216, 2196-0216","10.1002/celc.201700234","https://chemistry-europe.onlinelibrary.wiley.com/doi/10.1002/celc.201700234","Abstract                            The development of cost‐effective electrocatalysts is a key issue to promote the practical application of hydrazine as a viable energy carrier. Herein, a nickel‐foam‐supported Ni−Zn alloy catalyst is synthesized by electrodeposition and anodic dissolution methods. The developed catalyst with an opennanowall network structure and robust adhesion exhibits high activity and good durability for               electrooxidation of hydrazine               in an alkaline medium. For example, a current density of 300 mA cm               −2               at 0.40 Vand an onset potential of −0.15 V vs. the reversible hydrogen electrode are achieved in a 0.10 M hydrazine and 1.0 M NaOH solution at 30 °C. Phase and structure analysis by XRD, SEM, and XPS is conducted to gain insight into the excellent catalytic performance of theNi−Zn alloy catalyst. Such an understanding is of particular importance in the design of efficient non‐precious catalysts.","2017-08","2026-01-07 13:08:18","2026-01-07 13:08:18","2026-01-07 13:08:18","1944-1949","","8","4","","ChemElectroChem","","","","","","","","en","","","","","DOI.org (Crossref)","","","","C:\Users\Administrator\Zotero\storage\8VV52UT9\Wu 等 - 2017 - Ni−Zn Alloy Nanosheets Arrayed on Nickel Foamas a Promising Catalyst for Electrooxidation of Hydrazi.pdf","","","","","","","","","","","","","","","","","","","","","","","","","","","","","","","","","","","","","","","","","","","","","","","","",""
"ILWG2ZXH","journalArticle","2017","Ma, Xiao; Wang, Jianmei; Liu, Danni; Kong, Rongmei; Hao, Shuai; Du, Gu; Asiri, Abdullah M.; Sun, Xuping","Hydrazine-assisted electrolytic hydrogen production: CoS<sub>2</sub> nanoarray as a superior bifunctional electrocatalyst","New Journal of Chemistry","","1144-0546, 1369-9261","10.1039/C7NJ00326A","https://xlink.rsc.org/?DOI=C7NJ00326A","A CoS               2               nanoarray on Ti mesh acts as an efficient and durable catalyst for the hydrazine oxidation reaction and it only needs 0.81 V to attain 100 mA cm               −2               in 1.0 M KOH with 100 mM hydrazine for its two-electrode electrolyser.                        ,                             The sluggish kinetics of the oxygen evolution reaction has severely hindered the energetic convenience of electrolytic water splitting. Herein, we demonstrate that a CoS               2               nanoarray on Ti mesh (CoS               2               /TiM) behaves as an efficient and durable catalyst for the hydrazine oxidation reaction in 1.0 M KOH with 100 mM hydrazine, which requires the potential of 125 mV to achieve 100 mA cm               −2               . The high hydrogen-evolving activity of CoS               2               /TiM makes it a bifunctional catalyst for energy-saving electrolytic hydrogen generation by replacing water oxidation with hydrazine oxidation. To drive 100 mA cm               −2               , its two-electrode electrolyzer demands a low cell voltage of only 0.81 V and it exhibits remarkable long-term electrochemical durability and nearly 100% Faradic efficiency for hydrogen evolution.","2017","2026-01-07 13:08:23","2026-01-07 13:08:23","2026-01-07 13:08:23","4754-4757","","12","41","","New J. Chem.","Hydrazine-assisted electrolytic hydrogen production","","","","","","","en","","","","","DOI.org (Crossref)","","","","C:\Users\Administrator\Zotero\storage\MBMFIQXA\Ma 等 - 2017 - Hydrazine-assisted electrolytic hydrogen production CoS2 nanoarray as a superior bifunct.pdf","","","","","","","","","","","","","","","","","","","","","","","","","","","","","","","","","","","","","","","","","","","","","","","","",""
"9HY37ZSB","journalArticle","2025","Mohammadi, Ali; Kim, Hanseung; Arshia, Mohammad Javad; Han, Soobin; Sedhumadhavan, Abilash; Maleki, Reza; Vilian, A.T. Ezhil; Periasamy, Arun Prakash; Huh, Yun Suk; Han, Young‐Kyu","Bifunctional Fe─Ru─VC Catalyst for Energy Efficient Tandem Alkaline Electrolysis of Hydrazine and 4‐nitrophenol","Small","","1613-6810, 1613-6829","10.1002/smll.202507522","https://onlinelibrary.wiley.com/doi/10.1002/smll.202507522","Abstract                            Alternate electrocatalytic reactions can turn pollutants into green fuels, offering an energy‐efficient approach. Coupling hydrazine oxidation reaction (HzOR), with 4‐nitrophenol hydrogenation (4‐NPHR) is especially promising. Here, we report a bifunctional electrocatalyst composed of defect‐rich Fe–Ru alloy clusters uniformly anchored on vanadium carbide (Fe─Ru─VC), synthesized via scalable ball milling and thermal annealing. Fe─Ru─VC exhibits excellent electrocatalytic activity toward both HzOR and 4‐NPHR, requiring a low overpotential of 145 mV at 10 mA cm               −2               and a favorable Tafel slope of 68.9 mV dec               −1               for HzOR, with stability exceeding 90 h in 1M KOH. For 1 m               M               4‐NPHR, superior Fe‐Ru‐VC performance is achieved −7.2 mA cm               −2               at 100 mV, highlighting its high efficiency. Furthermore, a paired H‐cell electrolyzer (HzOR||4‐NPHR) operates at only 200 mV to deliver 40 mA cm               −2               , underscoring its low energy demand. In situ Raman spectroscopy confirms the formation of Fe─Ru(OOH) as active sites, UV–Vis analysis confirms rapid 4‐NP degradation, and DFT calculations demonstrate enhanced electronic interactions at the Ru─Fe junction, consistent with experimental observations. The outstanding activity is attributed to synergistic Fe‐Ru interactions, the presence of zigzag edge defects, and the excellent conductivity of the VC support.","2025-11","2026-01-07 13:08:31","2026-01-07 13:08:31","2026-01-07 13:08:31","e07522","","45","21","","Small","","","","","","","","en","","","","","DOI.org (Crossref)","","","","C:\Users\Administrator\Zotero\storage\EVSVQ22N\Mohammadi 等 - 2025 - Bifunctional Fe─Ru─VC Catalyst for Energy Efficient Tandem Alkaline Electrolysis of Hydrazine and 4‐.pdf","","","","","","","","","","","","","","","","","","","","","","","","","","","","","","","","","","","","","","","","","","","","","","","","",""
