"ZC73Z2NV","journalArticle","2023","Li, Kaixun; He, JinFeng; Guan, Xuze; Tong, Yun; Ye, Yutong; Chen, Lu; Chen, Pengzuo","Phosphorus‐Modified Amorphous High‐Entropy CoFeNiCrMn Compound as High‐Performance Electrocatalyst for Hydrazine‐Assisted Water Electrolysis","Small","","1613-6810, 1613-6829","10.1002/smll.202302130","https://onlinelibrary.wiley.com/doi/10.1002/smll.202302130","Abstract                            Exploiting highly active and bifunctional catalysts for both hydrogen evolution reaction (HER) and hydrazine oxidation reaction (HzOR) is a prerequisite for the hydrogen acquisition. High‐entropy materials have received widespread attention in catalysis, but the high‐performance bifunctional electrodes are still lacking. Herein, a novel P‐modified amorphous high‐entropy CoFeNiCrMn compound is developed on nickel foam (NF) by one‐step electrodeposition strategy. The achieved CoFeNiCrMnP/NF delivers remarkable HER and HzOR performance, where the overpotentials as low as 51 and 268 mV are realized at 100 mA cm               −2               . The improved cell voltage of 91 mV is further demonstrated at 100 mA cm               −2               by assessing CoFeNiCrMnP/NF in the constructed hydrazine‐assisted water electrolyser, which is almost 1.54 V lower than the HER||OER system. Experimental results confirm the important role of each element in regulating the bifuncational performance of high‐entropy catalysts. The main influencing elements seem to be Fe and Ni for HER, while the P‐modification and Cr metal may contribute a lot for HzOR. These synergistic advantages help to lower the energy barriers and improve the reaction kinetics, resulting in the excellent bifunctional activity of the CoFeNiCrMnP/NF. The work offers a feasible strategy to develop self‐supporting electrode with high‐entropy materials for overall water splitting.","2023-10","2026-01-07 13:08:35","2026-01-07 13:08:35","2026-01-07 13:08:35","2302130","","42","19","","Small","","","","","","","","en","","","","","DOI.org (Crossref)","","","","C:\Users\Administrator\Zotero\storage\SA89H84F\Li 等 - 2023 - Phosphorus‐Modified Amorphous High‐Entropy CoFeNiCrMn Compound as High‐Performance Electrocatalyst f.pdf","","","","","","","","","","","","","","","","","","","","","","","","","","","","","","","","","","","","","","","","","","","","","","","","",""
"U2LDEW4F","journalArticle","2024","Wang, Ziqiang; Li, Xinmiao; Zhang, Hugang; Yang, Guanghui; Deng, Kai; Yu, Hongjie; Xu, You; Wang, Hongjing; Wang, Liang","Amorphous/crystalline RhFeP metallene for hydrazine-assisted water splitting","Nanotechnology","","0957-4484, 1361-6528","10.1088/1361-6528/ad2c5b","https://iopscience.iop.org/article/10.1088/1361-6528/ad2c5b","Abstract                            Replacing the slow oxygen evolution reaction with favorable hydrazine oxidation reaction (HzOR) is a green and efficient way to produce hydrogen. In this work, we synthesize amorphous/crystalline RhFeP metallene via phase engineering and heteroatom doping. RhFeP metallene has good catalytic activity and stability for HER and HzOR, and only an ultralow voltage of 18 mV is required to achieve 10 mA cm               −2               in a two-electrode hydrazine-assisted water splitting system. The superior result is mainly ascribed to the co-doping of Fe and P and the formation of amorphous/crystalline RhFeP metallene with abundant phase boundaries, thereby adjusting electronic structure and increasing active sites.","2024-05-27","2026-01-07 13:08:39","2026-01-07 13:08:39","2026-01-07 13:08:39","225401","","22","35","","Nanotechnology","","","","","","","","","","","","","DOI.org (Crossref)","","","","C:\Users\Administrator\Zotero\storage\TXQTKWSJ\Wang 等 - 2024 - Amorphouscrystalline RhFeP metallene for hydrazine-assisted water splitting.pdf","","","","","","","","","","","","","","","","","","","","","","","","","","","","","","","","","","","","","","","","","","","","","","","","",""
"A93ISVYJ","journalArticle","2023","Sarker, Swagotom; Choi, Ji Hoon; Lee, Hak Hyeon; Kim, Dong Su; Cho, Hyung Koun","Surface‐Confined Ultra‐Low Scale Pd Engineered Layered Co(OH)<sub>2</sub> toward High‐Performance Hydrazine Electrooxidation in Alkaline Saline Water","Advanced Science","","2198-3844, 2198-3844","10.1002/advs.202300639","https://advanced.onlinelibrary.wiley.com/doi/10.1002/advs.202300639","Abstract                            Applications of abundant seawater in electrochemical energy conversion are constrained due to the sluggish oxygen evolution reaction and the corrosive chlorine oxidation reaction. Hence, it is imperative to develop an efficient anodic reaction alternative suitable for coupling with the cathodic counterpart. Due to a low thermodynamic oxidation potential, hydrazine oxidation reaction (HzOR) offers a unique pathway to overcome these challenges. Herein, spontaneously in situ reduced atomic scale Pd surface‐confined to electrochemically prepared layered Co(OH)               2               on carbon cloth is synthesized. This study reveals the hydrazine and Pd‐dependent morphological evolution of Co(OH)               2               and its Pd hybrids into nanoparticulate form. Unlike various layered double hydroxides, Pd integrated Co(OH)               2               benefits from the contribution of Co(OH)               2               as an active HzOR catalyst and the reductive support to host Pd, resulting in synergistically improved performances. Mass activities of Pd in alkaline and alkaline saline electrolyte are 11.24 and 9.83 A mg               Pd               −1               at 200 mV, respectively, corresponding to the highest HzOR activities among noble metals. The optimized Pd hybrid demonstrates ≈6.5 times the current density relative to PtC (14.91 mA cm               −2               at 200 mV) in alkaline saline water with hydrazine. These findings would be beneficial to realize high overpotential anodic alternatives and reduce over‐dependence on freshwater for electrocatalysis.","2023-07","2026-01-07 13:08:49","2026-01-07 13:08:49","2026-01-07 13:08:49","2300639","","21","10","","Advanced Science","","","","","","","","en","","","","","DOI.org (Crossref)","","","","C:\Users\Administrator\Zotero\storage\YSSZY26D\Sarker 等 - 2023 - Surface‐Confined Ultra‐Low Scale Pd Engineered Layered Co(OH)2 toward High‐Performance Hy.pdf","","","","","","","","","","","","","","","","","","","","","","","","","","","","","","","","","","","","","","","","","","","","","","","","",""
"YF2RA7UF","journalArticle","2025","Nguyen, Thanh Hai; Tran, Duy Thanh; Malhotra, Deepanshu; Tran, Phan Khanh Linh; Dinh, Van An; Ta, Thi Thuy Nga; Dong, Chung‐Li; Kim, Nam Hoon; Lee, Joong Hee","D‐Orbital‐Modulated Ruthenium Embedded within Functionalized Hollow MXene Networks for Enhanced Hydrazine‐Assisted Hydrogen Production","Small","","1613-6810, 1613-6829","10.1002/smll.202502553","https://onlinelibrary.wiley.com/doi/10.1002/smll.202502553","Abstract                            Electrochemical green hydrogen production via water splitting is an attractive and sustainable pathway; however, the sluggish kinetics of anodic oxygen evolution reaction is still a critical challenge. In this study, an effective electrocatalyst engineering approach is demonstrated by preparing an innovative hybrid of ruthenium d‐orbitals‐regulated nanoclusters embedding within functionalized hollow Ti               3               C               2               MXene networks (Ru               0.91               Ni               0.09               ‐N/O‐Ti               3               C               2               ) to promote the hydrazine‐assisted hydrogen production. A specific charge redistribution is revealed, locally concentrating at interfaces derived from stable Ru(Ni)‐N/O‐Ti coordination and               d               –               p               orbital hybridization. The charge transfer effect from Ni to Ru within Ru               0.91               Ni               0.09               structure and Ru               0.91               Ni               0.09               to N/O‐Ti               3               C               2               tailors electronic features of Ru sites to enable reasonable adsorption/desorption toward reactant intermediates. The Ru               0.91               Ni               0.09               ‐N/O‐Ti               3               C               2               requires an overpotential of only 29.3 mV for cathodic hydrogen evolution and a low potential of −29.9 mV for anodic hydrazine oxidation to reach 10 mA cm               −2               , showing excellent stability. The hydrazine‐assisted hydrogen production system based on Ru               0.91               Ni               0.09               ‐N/O‐Ti               3               C               2               electrodes delivers small cell voltages of 0.02 V at 10 mA cm               −2               and 0.92 V at industrial current level of 1.0 A cm               −2               . This work may open a new electrocatalysis strategy from lab scale to industry for robust and efficient green hydrogen production.","2025-06","2026-01-07 13:09:04","2026-01-07 13:09:04","2026-01-07 13:09:04","2502553","","22","21","","Small","","","","","","","","en","","","","","DOI.org (Crossref)","","","","C:\Users\Administrator\Zotero\storage\9YC8ZA9F\Nguyen 等 - 2025 - D‐Orbital‐Modulated Ruthenium Embedded within Functionalized Hollow MXene Networks for Enhanced Hydr.pdf","","","","","","","","","","","","","","","","","","","","","","","","","","","","","","","","","","","","","","","","","","","","","","","","",""
"LUPTYLC2","journalArticle","2025","Mo, Shao‐Xin; Su, Hai‐Liang; Chen, Jianhao; Liao, Wei; Wang, Yu; Wang, Hongjuan; Cao, Yonghai; Yu, Hao; Wang, Hao‐Fan","Defect‐Promoted Reductive Regeneration on Cobalt Catalysts Enables Efficient Dual‐Pathway Hydrazine Electrooxidation","Angewandte Chemie","","0044-8249, 1521-3757","10.1002/ange.202514064","https://onlinelibrary.wiley.com/doi/10.1002/ange.202514064","Abstract                            Hydrazine oxidation reaction (HzOR) represents a promising low‐energy pathway for sustainable hydrogen production, yet mechanistic ambiguities and catalyst instability hinder its practical implementation. Herein, we elucidate the dual‐pathway nature of HzOR on cobalt‐based catalysts, involving direct electrooxidation on metallic Co and mediated oxidation via the redox cycle between metallic Co and cobalt hydroxide species. This mechanistic insight moves beyond the traditional focus on solely enhancing the intrinsic activity in the direct pathway. Instead, it highlights the chemical redox reaction between hydrazine and Co(II) as a central process that not only regenerates metallic Co sites for direct pathway but also drives the mediated oxidation route. Guided by this understanding, we designed a defect‐rich cobalt catalyst through a one‐step electrodeposition method, enabling fast chemical reduction of oxidized Co species by hydrazine. As a result, the catalyst delivers superior HzOR performance, reaching a current density of 100 mA cm               −2               at only −79 mV versus reversible hydrogen electrode, along with outstanding long‐term stability. Combined electrochemical and density functional theory (DFT) analyses reveal that defect engineering significantly promotes the dual‐pathway HzOR on Co‐based catalysts. This work provides mechanistic understanding of HzOR electrocatalysis and highlights a general strategy for designing efficient, durable non‐noble metal electrocatalysts.","2025-11-03","2026-01-07 13:09:08","2026-01-07 13:09:08","2026-01-07 13:09:08","e202514064","","45","137","","Angewandte Chemie","","","","","","","","en","","","","","DOI.org (Crossref)","","","","C:\Users\Administrator\Zotero\storage\6TUNHXA9\Mo 等 - 2025 - Defect‐Promoted Reductive Regeneration on Cobalt Catalysts Enables Efficient Dual‐Pathway Hydrazine.pdf","","","","","","","","","","","","","","","","","","","","","","","","","","","","","","","","","","","","","","","","","","","","","","","","",""
"B53X4GH5","journalArticle","2025","Gicha, Birhanu Bayissa; Banti, Boka Fikadu; Molla, Cheru Fekadu; Kang, Hyojin; Goddati, Mahendra; Khoris, Indra Memdi; Nwaji, Njemuwa; Asgaran, Sohrab; Lee, Jaebeom","Interfacial Electronic Synergism in Cobalt‐Doped MoS<sub>2</sub> ‐COF Heterostructures for Energy‐Efficient Hydrazine‐Assisted Hydrogen Production","Small","","1613-6810, 1613-6829","10.1002/smll.202508200","https://onlinelibrary.wiley.com/doi/10.1002/smll.202508200","Abstract                            Hydrazine oxidation (HzOR) assisted hydrogen production offers a promising alternative to energy‐intensive and sluggish oxygen evolution reaction (OER), improving its efficiency. However, its practical implementation demands the development of advanced electrocatalysts capable of overcoming intrinsic kinetic and charge transfer limitations. Herein, the study reports a hybrid catalyst by anchoring a β‐ketoenamine linked covalent organic framework (TpPa‐1) on vertically aligned Co‐doped MoS               2               cuboids, enabling enhanced hydrazine‐assisted hydrogen evolution reaction (HER). The molecularly engineered heterostructure leverages interfacial electronic synergism to enhance charge delocalization and interfacial conductivity, thereby improving electrocatalytic performance. The hybrid catalyst exhibits low overpotentials of 43 mV for the HER and 88 mV for the HzOR at 10 mA cm               −2               . Combined experimental and theoretical analyses reveal that Co doping activates MoS               2               , while TpPa‐1 integration enhances charge delocalization and interfacial conductivity through electronic synergism. This work presents a robust strategy for molecular‐level interface engineering to enable efficient, bifunctional hydrogen production, establishing a foundation for the broader application of hybrid electrocatalysts.","2025-10","2026-01-07 13:09:12","2026-01-07 13:09:12","2026-01-07 13:09:12","e08200","","41","21","","Small","","","","","","","","en","","","","","DOI.org (Crossref)","","","","C:\Users\Administrator\Zotero\storage\Z2X5MSCH\Gicha 等 - 2025 - Interfacial Electronic Synergism in Cobalt‐Doped MoS2 ‐COF Heterostructures for Energy‐Ef.pdf","","","","","","","","","","","","","","","","","","","","","","","","","","","","","","","","","","","","","","","","","","","","","","","","",""
"4GFK2T5I","journalArticle","2023","Karmakar, Arun; Krishnan, Abhirami V.; Jayan, Rahul; Madhu, Ragunath; Islam, Md Mahbubul; Kundu, Subrata","Structural modulation of low-valent iron in LDH-derived Ni<sub>3</sub> Se<sub>4</sub> nanosheets: a breakthrough electrocatalyst for the overall water splitting reaction","Journal of Materials Chemistry A","","2050-7488, 2050-7496","10.1039/D3TA00868A","https://xlink.rsc.org/?DOI=D3TA00868A","Here an LDH-derived microporous Fe@Ni               3               Se               4               with enriched redox active Fe               2+               ion is reported. The same has acquired 10 mA cm               −2               current density with 185 and 33 mV of overpotential value in alkaline condition with high specific activity and durability.                        ,                             Transition metal-based layered double hydroxides (LDHs) have attracted significant attention in recent research in electrochemistry and hold promising capacity in a wide range of applications. Owing to their diverse chemical structure, improved mass- and charge-transfer kinetics, and fascinating 2D layered structure, LDHs have emerged to be promising electrocatalysts for water electrolysis. Yet, some limitations, including their low stability and poor conductivity, remain as major obstacles towards the application of LDHs in the field of electrocatalysis. As a result, various LDH-derived nanomaterials, like selenides, sulphides, phosphides,               etc.               , have been employed as effective electrocatalysts towards water splitting. Here in this study, a solvothermal reaction strategy was employed to derive a selenide from NiFe-LDH and the successful selenization resulted in the formation of Fe-doped Ni               3               Se               4               (Fe@Ni               3               Se               4               ) with a 2D microporous structure. The Fe@Ni               3               Se               4               showed excellent electrocatalytic performance for the oxygen evolution reaction (OER) and hydrogen evolution reaction (HER) in alkaline conditions, requiring just 185 and 33 mV overpotentials to drive 10 mA cm               −2               current density in the OER and HER, respectively, which outperformed many recently reported benchmark electrocatalysts. Also, a 10-fold increase in turnover frequency (TOF) was noticed in Fe@Ni               3               Se               4               compared to pristine NiFe-LDH, revealing an enormous improvement in specific activity as a result of the selenization. The presence of Fe with a lower valency provided an added advantage over the redox activity and stable structural outcomes, which was confirmed from operando impedance analysis and various other characterizations. First-principles DFT calculations revealed that doping low-valent Fe ions largely increased the 3d-2p repulsion in the Ni–O bonds, thereby facilitating the O               2               desorption process as compared to pristine Ni               3               Se               4               , as a result of the electronic exchange. Moreover, the downward shifting of the d-band centre with respect to the Fermi level modulated the binding strengths of the Fe-doped substrate towards H* compared to the pristine substrates.","2023","2026-01-07 13:09:18","2026-01-07 13:09:18","2026-01-07 13:09:18","10684-10698","","20","11","","J. Mater. Chem. A","Structural modulation of low-valent iron in LDH-derived Ni<sub>3</sub> Se<sub>4</sub> nanosheets","","","","","","","en","","","","","DOI.org (Crossref)","","","","C:\Users\Administrator\Zotero\storage\VESD8J5P\Karmakar 等 - 2023 - Structural modulation of low-valent iron in LDH-derived Ni3 Se4 nanosheets a.pdf","","","","","","","","","","","","","","","","","","","","","","","","","","","","","","","","","","","","","","","","","","","","","","","","",""
"SHZ89IGT","journalArticle","2025","Zhou, Min; Yu, Zhiqiang; Yu, Guo; Fu, Rong; Wang, Shuocheng; Yang, Wei; Liao, Xiaobin; Zhao, Yan; Wang, Zhaoyang","Constructing of <i>n</i> ‐Type Semiconductor Heterostructures for Efficient Hydrazine‐Assisted Hydrogen Production","Advanced Functional Materials","","1616-301X, 1616-3028","10.1002/adfm.202415058","https://advanced.onlinelibrary.wiley.com/doi/10.1002/adfm.202415058","Abstract                            Hydrazine‐assisted water electrolysis presents a promising approach toward energy‐efficient hydrogen production. However, the progress of this technology is hindered by the limited availability of affordable, efficient, and durable catalysts. In this study, a feasible strategy is proposed for interface modulation that enables efficient hydrogen evolution and hydrazine oxidation through the construction of               n               ‐type semiconductor heterostructures. The metal–semiconductor contacts are rationally designed using ruthenium nanoclusters and a range of metal oxide (M–O) semiconductor heterostructures, including               p               ‐type semiconductor substrates (NiO, Co               3               O               4               , NiCo               2               O               4               , CuCo               2               O               4               , ZnCo               2               O               4               ) and               n               ‐type semiconductor substrate (Fe               2               O               3               ). Intriguingly, Ru nanoclusters supported on               p               ‐type M–O substrates induce a transition from               p               ‐type M–O to               n               ‐type M‐O/Ru. The design of               n               ‐type semiconductor heterostructures can significantly reduce space‐charge regions and increase charge carrier concentration, thereby improving the electrical conductivity of electrocatalysts. Moreover, Ru atoms can serve as highly efficient active sites for hydrogen evolution reaction and hydrazine oxidation reaction. The NiO/Ru heterostructure can drive current densities of 10 and 100 mA cm               −2               with only 0.021 and 0.22 V cell voltages for hydrazine‐assisted water electrolysis. This work provides new insights for the development of highly efficient semiconductor catalysts, enabling energy‐saving hydrogen production.","2025-02","2026-01-07 13:09:22","2026-01-07 13:09:22","2026-01-07 13:09:22","2415058","","6","35","","Adv Funct Materials","","","","","","","","en","","","","","DOI.org (Crossref)","","","","C:\Users\Administrator\Zotero\storage\ZP9ADQ3X\Zhou 等 - 2025 - Constructing of n ‐Type Semiconductor Heterostructures for Efficient Hydrazine‐Assisted Hydro.pdf","","","","","","","","","","","","","","","","","","","","","","","","","","","","","","","","","","","","","","","","","","","","","","","","",""
"2JG9KYKU","journalArticle","2024","Feng, Zhongbao; Meng, Haoyu; Fu, Yumo; Ren, Lili; Gao, Bo; Liu, Wentao","Modulation of Charge Redistribution in Heterogeneous CoSe‐Ni<sub>0.95</sub> Se Coupling with Ti<sub>3</sub> C<sub>2</sub> T<sub>x</sub> MXene for Hydrazine‐Assisted Water Splitting","Small","","1613-6810, 1613-6829","10.1002/smll.202403270","https://onlinelibrary.wiley.com/doi/10.1002/smll.202403270","Abstract                            Integrating abundant dual sites of hydrazine oxidation reaction (HzOR) and hydrogen evolution reaction (HER) into one catalyst is extremely urgent toward energy‐saving H               2               production. Herein, CoSe‐Ni               0.95               Se heterostructure coupling with Ti               3               C               2               T               x               MXene (CoSe‐Ni               0.95               Se/MXene) is fabricated on nickel foam (NF) to enhance the catalytic performance. The heterogeneous CoSe‐Ni               0.95               Se and MXene coupling effect can change the coordination of Ni and Co, resulting in adjusted interfacial electronic field and enhanced electron transfer from Ni               0.95               Se to CoSe especially near MXene surface. Also, the appearance of MXene can anchor more active sites, thereby abundant nucleophilic CoSe and electrophilic Ni               0.95               Se are formed induced by the charge redistribution, which can tailor d‐band center, moderate               *               H adsorption free energy (∆G               H               *               ) and facilitate adsorption/desorption for hydrazine intermediates, contributing to much enhanced HER and HzOR performance. For example, the low potentials of −160.8 and 116.1 mV at 400 mA cm               −2               are seen for HER and HzOR with long‐term stability of 7 days. When assembled as overall hydrazine splitting (OHzS), a small cell voltage of 0.35 V to drive 100 mA cm               −2               is obtained. Such concept of integrating abundant nucleophilic and electrophilic dual sites and regulating their d‐band centers can offer in‐depth understandings to design efficient bifunctional HER and HzOR electrocatalysts.","2024-10","2026-01-07 13:09:26","2026-01-07 13:09:26","2026-01-07 13:09:26","2403270","","43","20","","Small","","","","","","","","en","","","","","DOI.org (Crossref)","","","","C:\Users\Administrator\Zotero\storage\KAEIIBIF\Feng 等 - 2024 - Modulation of Charge Redistribution in Heterogeneous CoSe‐Ni0.95 Se Coupling with Ti.pdf","","","","","","","","","","","","","","","","","","","","","","","","","","","","","","","","","","","","","","","","","","","","","","","","",""
