"YZPAJ699","journalArticle","2023","Liu, Chaofan; Shi, Xue‐Rong; Yue, Kaihang; Wang, Peijie; Zhan, Ke; Wang, Xianying; Xia, Bao Yu; Yan, Ya","S‐Species‐Evoked High‐Valence Ni<sup>2+</sup><sup>δ</sup> of the Evolved β‐Ni(OH)<sub>2</sub> Electrode for Selective Oxidation of 5‐Hydroxymethylfurfural","Advanced Materials","","0935-9648, 1521-4095","10.1002/adma.202211177","https://advanced.onlinelibrary.wiley.com/doi/10.1002/adma.202211177","Abstract                            An efficient NiS                                x                              ‐modified β‐Ni(OH)               2               electrode is reported for the selective oxidation reaction of 5‐hydroxymethylfurfural (HMFOR) with excellent electrocatalytic 5‐hydroxymethylfurfural (HMF) selectivity (99.4%), conversion (97.7%), and Faradaic efficiency (98.3%). The decoration of NiS                                x                              will evoke high‐valence Ni               2+                                δ                              species in the reconstructed β‐Ni(OH)               2               electrode, which are the real active species for HMFOR. The generated NiS                                x                              /Ni(OH)O modulates the proton‐coupled electron‐transfer (PCET) process of HMFOR, where the electrocatalytically generated Ni(OH)O can effectively trap the protons from the CHO end in HMF to realize electron transfer. The oxygen evolution reaction (OER) competes with the HMFOR when NiS                                x                              /Ni(OH)O continues to accumulate, to generate the NiS                                x                              /NiO                                x                              (OH)                                y                              intermediate. Density functional theory (DFT) calculations and experimental results verify that the adsorption energy of HMF can be optimized through the increased NiS                                x                              composition for more efficient capture of protons and electrons in the HMFOR.","2023-03","2026-01-05 13:19:18","2026-01-08 03:58:04","2026-01-08 03:16:02","2211177","","12","35","","Advanced Materials","","","","","","","","en","","","","","DOI.org (Crossref)","","","","C:\Users\Administrator\Zotero\storage\ZPWU5RRL\Liu 等 - 2023 - S‐Species‐Evoked High‐Valence Ni2+δ of the Evolved β‐Ni(OH)2 Electr.pdf","","","","","","","","","","","","","","","","","","","","","","","","","","","","","","","","","","","","","","","","","","","","","","","","",""
"Z3GPQSAC","journalArticle","2024","Zhang, Yanyan; Hai, Guangtong; Huang, Zhuoshen; Liu, Zhimeng; Huang, Xiubing; Wang, Ge","Ce‐Doping Rather Than CeO<sub>2</sub> Modification and Their Synergistic Effect: Promotion from Ce Species in the Electrocatalytic Oxidation of 5‐Hydroxymethylfurfural Over NiFe–LDH","Advanced Energy Materials","","1614-6832, 1614-6840","10.1002/aenm.202401449","https://advanced.onlinelibrary.wiley.com/doi/10.1002/aenm.202401449","Abstract                            Electrocatalytic oxidation of 5‐hydroxymethylfurfural (HMFOR) is an effective route to produce value‐added chemicals with low energy consumption. In this work, efficient electrocatalysts are prepared by varying the amount of Ce doping and CeO               2               modification on NiFe layered double hydroxide (NiFe–LDH) nanosheets supported on carbon cloth (CC). Through Ce doping and heterogeneous interface construction, the electronic structure and coordination chemistry of NiFe–LDH are greatly changed. Compared to CeO               2               modification and the synergistic effect of Ce‐doping and CeO               2               modification, CC@NiFeCe(3%)‐LDH with only Ce‐doping show excellent charge transfer ability, higher HMF conversion (95.73%), 2,5‐furandicarboxylic acid (FDCA) selectivity (93.31%), and Faraday efficiency (99.47%) at only 1.44                V               RHE               . Density‐functional theory calculations and X‐ray fine structure spectroscopy demonstrate that Ce doping, compared with CeO               2               modification and their synergistic effects, significantly facilitates the electron transport and optimizes intermediate adsorption by effectively lowering the activation energy for the transformation of 5‐formyl‐2‐furancarboxylic acid (FFCA) and encourage the conversion of FFCA to FDCA. Overall, this work systemically investigates the HMFOR behaviors of CC@NiFe–LDH under Ce doping, CeO               2               modification, and their synergetic effect, which provides some guidance on the development of high‐performance electrocatalysts for HMFOR performance.","2024-10","2026-01-05 13:19:19","2026-01-08 03:58:04","2026-01-08 03:16:10","2401449","","38","14","","Advanced Energy Materials","Ce‐Doping Rather Than CeO<sub>2</sub> Modification and Their Synergistic Effect","","","","","","","en","","","","","DOI.org (Crossref)","","","","C:\Users\Administrator\Zotero\storage\YUCYKP67\Zhang 等 - 2024 - Ce‐Doping Rather Than CeO2 Modification and Their Synergistic Effect Promotion from Ce S.pdf","","","","","","","","","","","","","","","","","","","","","","","","","","","","","","","","","","","","","","","","","","","","","","","","",""
"QMPLQEPM","journalArticle","2025","Guo, Xianan; Zhang, Maolin; Wang, Wenyang; Xie, Zhenyu; Lin, Lixin; Li, Pengwei; Li, Guanju; Chen, Zhuo; Bo, Shuhui","Constructing Oxygen Vacancy‐Enriched Ag‐Mn(OH)<sub>2</sub> via Anionic Leaching and Ag Modification: Inducing High‐Valence Mn Active Sites for Efficient Electrocatalytic Oxidation of 5‐Hydroxymethylfurfural","Advanced Energy Materials","","1614-6832, 1614-6840","10.1002/aenm.202502935","https://advanced.onlinelibrary.wiley.com/doi/10.1002/aenm.202502935","Abstract                            Electrochemical oxidation of 5‐hydroxymethylfurfural (HMF) using non‐precious transition metal catalysts presents a sustainable pathway for producing high‐value 2,5‐furandicarboxylic acid (FDCA). Manganese‐based materials hold promise for HMF oxidation reactions but suffer from low intrinsic conductivity and sluggish kinetics in the formation of high‐valence Mn active species. Herein, a multi‐scale engineering strategy to construct a 3D Ag‐Mn(OH)               2               ‐O               V               /nickel foam (NF) catalyst by synergistically integrating electrochemical activation‐induced MoO               4               2−               leaching and Ag nanoparticle modification on a pre‐synthesized MnMoO               4               /NF is proposed. Spectroscopic characterizations reveal that this dual‐functional modification strategy collectively generates an Ag‐Mn(OH)               2               ‐O               V               /NF heterostructure enriched with oxygen vacancies (O               V               ), thereby facilitating the formation of high‐valent Mn               3+               active centers. Moreover, the synergistic interplay between O               V               and Ag nanoparticles not only enhances the adsorption of reactants and reaction intermediates but also optimizes interfacial charge transfer, consequently lowering the overall reaction energy barrier. These cooperative effects collectively drive the superior catalytic performance of the Ag‐Mn(OH)               2               ‐O               V               /NF. As a result, the Ag‐Mn(OH)               2               ‐O               V               /NF catalyst achieves 100% HMF conversion rate and 98.60% FDCA Faradaic efficiency (FE) at 1.40 V versus. RHE, with its FE significantly higher than those of catalysts Mn(OH)               2               ‐O               V               /NF (70.11%) and Ag/NF (62.02%), and the electrolysis time is approximately halved.","2025-10","2026-01-05 13:19:20","2026-01-08 03:58:04","2026-01-08 03:16:18","e02935","","37","15","","Advanced Energy Materials","Constructing Oxygen Vacancy‐Enriched Ag‐Mn(OH)<sub>2</sub> via Anionic Leaching and Ag Modification","","","","","","","en","","","","","DOI.org (Crossref)","","","","C:\Users\Administrator\Zotero\storage\V2ZBJUTF\Guo 等 - 2025 - Constructing Oxygen Vacancy‐Enriched Ag‐Mn(OH)2 via Anionic Leaching and Ag Modification.pdf","","","","","","","","","","","","","","","","","","","","","","","","","","","","","","","","","","","","","","","","","","","","","","","","",""
"ESJLKEPF","journalArticle","2025","Holade, Yaovi; Guesmi, Hazar","Nickel-Cobalt Phosphide Microstructure Refinement for Electroconversion of Biomass-Derived 5-Hydroxymethylfurfural (5-HMF) to 2,5-Furandicarboxylic Acid (FDCA)","ECS Meeting Abstracts","","2151-2043","10.1149/MA2025-01522586mtgabs","https://iopscience.iop.org/article/10.1149/MA2025-01522586mtgabs","Self-supporting multiple element-based transition metal phosphides (TMPs) comprising Ni, Co and P are expected to constitute a unique class of electrocatalytic materials exploiting the synergistic interplay between ensemble (geometrical) and ligand (electronic) effects               1,2               resulting from the presence of different metals in the material and the arrangement of heterogeneous atoms in a single alloy within a nanostructured N,S,P-doped carbon lattice. However, their preparation has been limited by several factors, not least the synthesis methodology and the radical difference between the crystal structures of the respective monometallic phosphides, where Ni               2               P adopts a hexagonal structure while CoP exhibits an orthorhombic structure. Indeed, conventional synthesis of supported nanostructured TMPs as electrocatalysts often separates nanoparticles, support and ex situ phosphidation steps, which hinders the tailoring of physical and catalytic properties through particle-support, electronic and geometrical interactions. Furthermore, the electrocatalytic conversion/upgrading of organic matters, where the anode reaction of an electrolyzer, e.g. the oxygen evolution reaction (OER), would be replaced by the electro-oxidation of abundant biomass, enables to reduce the cell voltage and, at the same time, to co-produce important renewable chemicals for the manufacture of biopolymers, detergents, food ingredients, and so on. Indeed, due to the high overpotential required to perform OER, a significant part of the energy needed to reduce H               2               O, CO               2               , N               2               or NO               3               −               to fuels or chemicals is consumed by the accompanying OER during HER, CO               2               , NRR, CO2RR.                                         In this contribution, we present a solid-state approach, tailored to efficiently synthesize a library of self-supporting Ni               x               Co               y               P TMPs in N,S,P-doped nanostructured carbon networks generated with Ni               x               Co               y               P particles, with the aim of addressing microstructure refinement for improved physical and electrocatalytic properties.               3               Our results demonstrate that, despite the structural divergence of monometallic phosphides (Ni               2               P (hexagonal), CoP (orthorhombic)), a single hexagonal Ni               2-x               Co               x               P phase (0 ≤ x < 2) is obtained for bimetallic phosphide materials, ruling out the hypothesis of segregated phases during carbothermal reduction. Moreover, the presence of P as negative sites (P               δ-               ) modifies the electronic properties of Ni as positive sites (Ni               δ+               ) while cobalt improves the chemical stability of nickel, resulting in Ni               2-x               Co               x               P electrocatalytic species with the best compromise in terms of current density and selectivity when 0.5 ≤ x ≤ 1, for instance the electro-conversion of biomass-derived 5-HMF (5-hydroxymethylfurfural) to FDCA (2,5-furandicarboxylic acid) as co-generation value-added products with high faradaic efficiency (90-100%) and efficient activity for HER. Specifically, the oxidation of 5-HMF on Ni               2-x               Co               x               P is driven by the Ni               1-x               Co               x               (OH)               2               /Ni               1-x               Co               x               (OOH) redox center during an indirect oxidation mechanism, wherein the presence of P in the electrocatalytic material regulates the electron transfer capacity. Upon the first proton-coupled electron transfer (PCET) step of dehydrogenation of 5-HMF molecules, Ni-based active sites are likely to be occupied by organic adducts, while proton species are transferred to neighboring cobalt and phosphorus active sites.                                                                                                  P. Strasser, S. Koh, T. Anniyev, J. Greeley, K. More, C. Yu, Z. Liu, S. Kaya, D. Nordlund, H. Ogasawara, M. F. Toney and A. Nilsson,                     Nat. Chem.                     ,                     2                     , 454 (2010).                                                                                             C. Lim, A. R. Fairhurst, B. J. Ransom, D. Haering and V. R. Stamenkovic,                     ACS Catal.                     ,                     13                     , 14874 (2023).                                                                                             S. Knani, M. Tauk, P. Hajjar, M.-A. Lacour, M. Shahrokhi, C. Canaff, C. Morais, S. Morisset, P. Huguet, D. Cot, B. Rebiere, E. Oliviero, V. Bonniol, J. Cambedouzou, M. Bechelany, S. Tingry, K. B. Kokoh, T. W. Napporn, H. Guesmi, D. Cornu and Y. Holade,                     Small Struct.                     ,                     5                     , 2400276 (2024).                                                                                                                      Figure 1","2025-07-11","2026-01-08 03:16:26","2026-01-08 03:16:26","2026-01-08 03:16:26","2586-2586","","52","MA2025-01","","Meet. Abstr.","","","","","","","","","","","","","DOI.org (Crossref)","","","","","","","","","","","","","","","","","","","","","","","","","","","","","","","","","","","","","","","","","","","","","","","","","","","","",""
"YF82IABL","journalArticle","2025","Lu, Chenbao; Yang, Sen; Shi, Pengfei; Huang, Senhe; Cai, Chengcheng; Zhu, Jinhui; Zhuang, Xiaodong; Wang, Tianfu","Integrated Electrochemical Biomass Oxidation and CO<sub>2</sub> Reduction over Ultra‐wide Potential Window","Angewandte Chemie","","0044-8249, 1521-3757","10.1002/ange.202502846","https://onlinelibrary.wiley.com/doi/10.1002/ange.202502846","Abstract                            Electrochemical reduction of carbon dioxide (CO               2               ) coupled with biomass oxidation using renewable electricity is considered as a promising strategy for carbon management. However, achieving both high selectivity and large current density over wide potential window remains a significant challenge, hindering practical applications. In this study, a Ni/Fe dual metal‐atom catalyst is developed for CO               2               reduction, achieving nearly 100 % CO selectivity across an ultra‐wide potential window of 1.6 V, surpassing state‐of‐the‐art catalysts. Remarkably, this high CO selectivity is maintained above 98 % even after 100 hours of continuous operation at an industrial current density of 200 mA cm               −2               , demonstrating excellent long‐term stability. When integrated into a solar electricity‐driven CO               2               reduction coupled 5‐hydroxymethylfurfural oxidation system, nearly 100 % CO Faradaic efficiency and 90 % 2,5‐furandicarboxylic acid yield are simultaneously obtained. Theoretical calculations reveal that the rate‐limiting step for the CO               2               reduction reaction varies with the applied potential, and the synergistic interaction between Ni and Fe atoms effectively lowers the limiting energy barrier. This work offers valuable insights for the strategic design and synthesis of catalysts with high activity and selectivity across wide potential window, providing a versatile platform for coupling CO               2               reduction with diverse anodic biomass oxidation reactions and renewable energy sources.","2025-05-12","2026-01-05 13:19:23","2026-01-08 03:58:05","2026-01-08 03:16:34","e202502846","","20","137","","Angewandte Chemie","","","","","","","","en","","","","","DOI.org (Crossref)","","","","C:\Users\Administrator\Zotero\storage\G854SVVD\Lu 等 - 2025 - Integrated Electrochemical Biomass Oxidation and CO2 Reduction over Ultra‐wide Potential.pdf","","","","","","","","","","","","","","","","","","","","","","","","","","","","","","","","","","","","","","","","","","","","","","","","",""
"SHSZK6TL","journalArticle","2023","Zhang, Zonghang; Liu, Shan; Wu, Zhao; Chen, Xiaoyan; Wang, Jingui; Gao, Yuji; Wang, Shuai; Tao, Furong; Lv, Guangqiang","High efficiency coupled electrocatalytic CO<sub>2</sub> reduction to C<sub>2</sub> H<sub>4</sub> with 5-hydroxymethylfurfural oxidation over Cu-based nanoflower electrocatalysts","Green Chemistry","","1463-9262, 1463-9270","10.1039/D3GC01420G","https://xlink.rsc.org/?DOI=D3GC01420G","CO               2               electroreduction and 5-hydroxymethylfurfural electrooxidation were coupled together over Cu base nanoflower catalyst and faradaic efficiency of FDCA and C               2               H               4               reached to 96.6% and 74.5% respectively at a cell voltage of 2.75 V.                        ,                             To improve the total value of the redox products and energy conversion efficiency in CO               2               electroreduction (CO               2               RR) and 5-hydroxymethylfurfural electrooxidation (HMFOR), commercial Cu foam was chemically oxidized into nanoflower CuO on its surface and used as an electrocatalyst in both CO               2               RR and HMFOR. In CO               2               RR, the prepared CuO nanoflower on Cu foam (CuO-NF@Cu) was quickly reduced to hybrid Cu               2               O/Cu nanoflower (Cu               2               O/Cu-NF@Cu). At a reduction potential of −0.95 V (               vs.               RHE), a high C               2               H               4               faradaic efficiency (FE) up to 70% with a current density of 104.5 mA cm               −2               can be obtained within 45 h of testing. In HMFOR, CuO-NF@Cu gave a 99.3% FDCA FE at a potential of 1.62 V (               vs.               RHE). Moreover, CO               2               RR and HMFOR can be coupled together with CuO-NF@Cu as the anode electrocatalyst and Cu               2               O/Cu-NF@GDL as the cathode electrocatalyst. A current density up to 188.8 mA cm               −2               at a cell voltage of 2.75 V can be obtained. FEs of FDCA and C               2               H               4               up to 96.6%/74.5%, respectively, were achieved in coupled CO               2               RR-HMFOR within 5 h. This work makes it easy to simultaneously efficiently convert CO               2               to high-value C               2               H               4               and upgrade a renewable biomass platform compound.","2023","2026-01-05 13:19:24","2026-01-08 03:58:05","2026-01-08 03:16:42","5404-5415","","14","25","","Green Chem.","","","","","","","","en","","","","","DOI.org (Crossref)","","","","C:\Users\Administrator\Zotero\storage\VLG2XUXW\Zhang 等 - 2023 - High efficiency coupled electrocatalytic CO2 reduction to C2 H4 wit.pdf","","","","","","","","","","","","","","","","","","","","","","","","","","","","","","","","","","","","","","","","","","","","","","","","",""
"QY4LT29E","journalArticle","2025","Wu, Yufeng; Hou, Zhiyan; Wang, Changlong","Construction of an Sc-NiFe-LDH electrocatalyst for highly efficient electrooxidation of 5-hydroxymethylfurfural at industrial current density","Nanoscale","","2040-3364, 2040-3372","10.1039/D4NR04389H","https://xlink.rsc.org/?DOI=D4NR04389H","Sc-NiFe-LDH catalyzed electrooxidation of HMF to FDCA, achieving the FDCA faradic efficiency and selectivity of 96.5% and 99.5%, respectively, at a current density of >600 mA cm               −2               .                        ,                             Renewable electricity-powered electrooxidation of 5-hydroxymethylfurfural (HMFOR) to FDCA offers a green and sustainable approach to producing an essential monomer for bio-polymers, provided that a highly efficient electrocatalyst is present. Herein, we show that the doping of scandium (Sc) into an NiFe-LDH electrocatalyst (Sc-NiFe-LDH) considerably promotes HMFOR by enhancing the formation of high-valence Ni               III               –O active sites, facilitating electron transport and HMF adsorption and suppressing the oxygen evolution reaction. In the presence of the Sc-NiFe-LDH electrocatalyst, an FDCA faradaic efficiency and selectivity of 96.5% and 99.5%, respectively, were achieved at a current density of >600 mA cm               −2               . The high performance of the Sc-NiFe-LDH electrocatalyst is the best among those of other reported electrocatalysts for this reaction, showing great promise in upgrading biomass to valuable chemicals. This work would inspire further studies on the rational design of novel and efficient electrocatalysts for green and sustainable energy transformations.","2025","2026-01-05 13:19:26","2026-01-08 03:58:05","2026-01-08 03:16:51","3114-3122","","6","17","","Nanoscale","","","","","","","","en","","","","","DOI.org (Crossref)","","","","C:\Users\Administrator\Zotero\storage\A2WZ2LXZ\Wu 等 - 2025 - Construction of an Sc-NiFe-LDH electrocatalyst for highly efficient electrooxidation of 5-hydroxymet.pdf","","","","","","","","","","","","","","","","","","","","","","","","","","","","","","","","","","","","","","","","","","","","","","","","",""
"CJ2PB8DL","journalArticle","2025","Huang, Yuhui; Tao, Yehan; Jia, Zhenghao; Fu, Chenglong; Hu, Jinwen; Du, Jian; Lu, Jie; Lv, Yanna; Wang, Haisong","Modulated D‐Electron Transfer in Hypervalent Cobalt‐Based Electrocatalyst for Efficient 5‐Hydroxymethylfurfural Electrooxidation","Small","","1613-6810, 1613-6829","10.1002/smll.202501476","https://onlinelibrary.wiley.com/doi/10.1002/smll.202501476","Abstract                            5‐hydroxymethylfurfural (5‐HMF) electrooxidation is important in producing biomass‐based valuable chemicals, whereas the preferential adsorption of only hydroxymethyl or formyl on a specific catalyst limits the reaction efficiency. Herein, the electrochemical synthesis of copper incorporated CoOOH electrocatalyst is reported that can execute the synchronized adsorption of both groups. The catalyst works under a low applied potential of 1.36 V               RHE               , achieving 100% HMF conversion, 100% furan dicarboxylic acid yield and 96.8% Faraday efficiency, with good stability, repeatability and variety in catalyzing furfural electrooxidation to furoic acid. This superior performance is attributed to Cu incorporation that reduces the bandgap of CoOOH by d‐orbital electrons contributing more significantly near the Fermi level and adjusts the morphology through constructing smaller and more compact particles over granular or sheet‐like motifs. The operando Raman characterization and theoretical calculations verify a strong interaction between 5‐HMF and the Cu‐integrated CoOOH catalyst, which is ascribed to the altered local charge density regions by Cu species and enables stable adsorption of both hydroxymethyl and formyl functional groups. This work lays foundation for a versatile and energy‐efficient strategy for biorefinery, enabling seamless integration with green electricity‐driven hydrogen production, while accelerating advancements in renewable energy and green chemistry.","2025-07","2026-01-05 13:19:27","2026-01-08 03:58:05","2026-01-08 03:16:59","2501476","","27","21","","Small","","","","","","","","en","","","","","DOI.org (Crossref)","","","","C:\Users\Administrator\Zotero\storage\WEMM8JBW\Huang 等 - 2025 - Modulated D‐Electron Transfer in Hypervalent Cobalt‐Based Electrocatalyst for Efficient 5‐Hydroxymet.pdf","","","","","","","","","","","","","","","","","","","","","","","","","","","","","","","","","","","","","","","","","","","","","","","","",""
