"QQVQRWF2","journalArticle","2025","Xu, Haishan; Li, Yinghua; Xie, Zhenbing; Wang, Xin; Yang, Runlu; Wu, Haoran; Mai, Yiyong","Highly efficient electrooxidation of biomass-based 5-hydroxymethylfurfural to 2,5-furandicarboxylic acid over a Cu–Ni bimetal–phytic acid hybrid electrocatalyst","Chemical Communications","","1359-7345, 1364-548X","10.1039/D4CC05268D","https://xlink.rsc.org/?DOI=D4CC05268D","High-performance biomass-derived Cu–Ni@PA hybrids were constructed for the electrochemical oxidation of 5-hydroxymethylfurfural to high-value-added 2,5-furandicarboxylic acid, with high faradaic efficiency (96.7%) and selectivity (97.5%).           ,                             High-performance copper/nickel@phytic acid hybrids (Cu–Ni(               x               )@PA) using plant-originated phytic acid as a building block were constructed for the electrooxidation of 5-hydroxymethylfurfural to 2,5-furandicarboxylic acid. The optimized Cu–Ni(2)@PA shows excellent performance with high faradaic efficiency (96.7%) and selectivity (97.5%). The mechanism behind such high efficiency was revealed.","2025","2026-01-05 13:19:28","2026-01-08 03:58:05","2026-01-08 03:17:07","330-333","","2","61","","Chem. Commun.","","","","","","","","en","","","","","DOI.org (Crossref)","","","","C:\Users\Administrator\Zotero\storage\EBJ7CEI9\Xu 等 - 2025 - Highly efficient electrooxidation of biomass-based 5-hydroxymethylfurfural to 2,5-furandicarboxylic.pdf","","","","","","","","","","","","","","","","","","","","","","","","","","","","","","","","","","","","","","","","","","","","","","","","",""
"B2QFGAU4","journalArticle","2023","Zhao, Lei; Du, Shichao; Gong, Rui; Jia, Wanqi; Chen, Zhimin; Ren, Zhiyu","CoO–Co Heterojunction Covered with Carbon Enables Highly Efficient Integration of Hydrogen Evolution and 5-Hydroxymethylfurfural Oxidation","Molecules","","1420-3049","10.3390/molecules28073040","https://www.mdpi.com/1420-3049/28/7/3040","The renewable-energy-driven integration of hydrogen production and biomass conversion into value-added products is desirable for the current global energy transition, but still a challenge. Herein, carbon-coated CoO–Co heterojunction arrays were built on copper foam (CoO–Co@C/CF) by the carbothermal reduction to catalyze the hydrogen evolution reaction (HER) coupled with a 5-hydroxymethylfurfural electrooxidation reaction (HMFEOR). The electronic modulation induced by the CoO–Co heterojunction endows CoO–Co@C/CF with a powerful catalytic ability. CoO–Co@C/CF is energetic for HER, yielding an overpotential of 69 mV at 10 mA·cm−1 and Tafel slope of 58 mV·dec−1. Meanwhile, CoO–Co@C/CF delivers an excellent electrochemical activity for the selective conversion from HMF into 2,5-furandicarboxylic acid (FDCA), achieving a conversion of 100%, FDCA yield of 99.4% and faradaic efficiency of 99.4% at the lower oxidation potential, along with an excellent cycling stability. The integrated CoO–Co@C/CF||CoO–Co@C/CF configuration actualizes the H2O–HMF-coupled electrolysis at a satisfactory cell voltage of 1.448 V at 10 mA·cm−2. This work highlights the feasibility of engineering double active sites for the coupled electrolytic system.","2023-03-29","2026-01-05 13:19:29","2026-01-08 03:58:05","2026-01-08 03:17:15","3040","","7","28","","Molecules","","","","","","","","en","","","","","DOI.org (Crossref)","","","","C:\Users\Administrator\Zotero\storage\9TES7STL\Zhao 等 - 2023 - CoO–Co Heterojunction Covered with Carbon Enables Highly Efficient Integration of Hydrogen Evolution.pdf","","","","","","","","","","","","","","","","","","","","","","","","","","","","","","","","","","","","","","","","","","","","","","","","",""
"MRSB435X","journalArticle","2023","Bi, Jiahui; Xu, Hui; Wang, Wenke; Sang, Ting; Jiang, Anning; Hao, Jingcheng; Li, Zhonghao","Cu<sub>2</sub> P<sub>7</sub> ‐CoP Heterostructure Nanosheets Enable High‐Performance of 5‐Hydroxymethylfurfural Electrooxidation","Chemistry – A European Journal","","0947-6539, 1521-3765","10.1002/chem.202300973","https://chemistry-europe.onlinelibrary.wiley.com/doi/10.1002/chem.202300973","Abstract                            Electrooxidation of 5‐hydroxymethylfural (HMF) into 2,5‐furandicarboxylicacid (FDCA) has been regarded as a promising sustainable approach to achieve value‐added chemicals. However, it is still impeded by the unsatisfactory performance of electrocatalysts. Here, Cu               2               P               7               ‐CoP heterostructure nanosheets were reported to enable powerful HMF electrooxidation. The Cu               2               P               7               ‐CoP heterostructure nanosheets were fabricated by microwave‐assisted deep eutectic solvent (DES) approach, along with subsequent phosphiding. The Cu               2               P               7               ‐CoP heterostructure nanosheets enabled a superb 100 % HMF conversion at 1.43 V (vs. RHE) with 98.8 % FDCA yield and 98 % Faradaic efficiency (FE), demonstrating its promising application in HMF electrooxidation. X‐ray photoelectron spectroscopy (XPS) analysis, open‐circuit potential (OCP) approach and density functional theory (DFT) calculation uncovered that the electron transfer and redistribution between Cu               2               P               7               and CoP improved the adsorption capacity of HMF and modulated the catalytic performance. This study not only offered a powerful electrocatalyst for HMF electrooxidation, but also provided a conceptually new strategy for the heterostructure catalyst design.","2023-07-26","2026-01-05 13:19:34","2026-01-08 03:58:06","2026-01-08 03:17:23","e202300973","","42","29","","Chemistry A European J","","","","","","","","en","","","","","DOI.org (Crossref)","","","","C:\Users\Administrator\Zotero\storage\N2F5QL2F\Bi 等 - 2023 - Cu2 P7 ‐CoP Heterostructure Nanosheets Enable High‐Performance of 5‐Hydroxymet.pdf","","","","","","","","","","","","","","","","","","","","","","","","","","","","","","","","","","","","","","","","","","","","","","","","",""
"IJVFC8IH","journalArticle","2022","Chai, Xinyu; Jiang, Kaiyue; Wang, Jianying; Ren, Zhouhong; Liu, Xi; Chen, Liwei; Zhuang, Xiaodong; Wang, Tianfu","Efficient Catalytic Conversion of 5‐Hydroxymethylfurfural to 2,5‐Furandicarboxylic Acid over Ruthenium Cluster‐Embedded Ni(OH)<sub>2</sub> Catalyst","ChemSusChem","","1864-5631, 1864-564X","10.1002/cssc.202200863","https://chemistry-europe.onlinelibrary.wiley.com/doi/10.1002/cssc.202200863","Abstract                            5‐Hydroxymethylfurfural (HMF) can be oxidized to 2,5‐furandicarboxylic acid (FDCA) for the production of biorenewable plastics to replace fossil resourced polyethylene terephthalate (PET). Development of a highly efficient electrocatalyst using renewable electricity as energy input is highly desired. In this work, Ru cluster‐embedded Ni(OH)               2               nanosheets [Ru/Ni(OH)               2               ] were synthesized and exploited as electrochemical catalysts for the conversion of HMF to FDCA. Ru/Ni(OH)               2               exhibited significantly improved current density (40 mA cm               −2               at 1.41 V vs. reversible hydrogen electrode) of over 7.7 times in comparison with Ni(OH)               2               , and nearly 100 % conversion degree for HMF and 98.5 % selectivity towards FDCA were obtained. Operando Raman experiments revealed the catalysis was facilitated by the interconversion between Ni               3+               and Ni               2+               . Density functional theory calculations further revealed the effect of Ru clusters of Ni(OH)               2               , thereby promoting HMF adsorption capacity on Ni sites to boost HMF oxidation activity. This work provides a novel strategy using Ru clusters to modify earth abundant Ni based catalyst for HMF oxidation to obtain high‐value biomass‐derived products.","2022-08-19","2026-01-05 13:19:35","2026-01-08 03:58:06","2026-01-08 03:17:31","e202200863","","16","15","","ChemSusChem","","","","","","","","en","","","","","DOI.org (Crossref)","","","","C:\Users\Administrator\Zotero\storage\PX5YAWYD\Chai 等 - 2022 - Efficient Catalytic Conversion of 5‐Hydroxymethylfurfural to 2,5‐Furandicarboxylic Acid over Rutheni.pdf","","","","","","","","","","","","","","","","","","","","","","","","","","","","","","","","","","","","","","","","","","","","","","","","",""
"PEYY935M","journalArticle","2025","Xu, Hui; Wang, Wenke; Sang, Ting; Hao, Jingcheng; Zhang, Xiaoyu; Li, Zhonghao","Mn‐Doped Ni(OH)<sub>2</sub> Nanosheets as High‐Performance Electrocatalyst for 5‐Hydroxymethylfurfural Electrooxidation","Chemistry – An Asian Journal","","1861-4728, 1861-471X","10.1002/asia.202401753","https://aces.onlinelibrary.wiley.com/doi/10.1002/asia.202401753","Abstract                            Converting 5‐hydroxymethylfurfural (HMF) to 2,5‐furandicarboxylic acid (FDCA) via electrooxidation is a sustainable approach for generating high‐value chemicals from biomass. This study presents Mn‐doped Ni(OH)               2               nanosheets as an effective electrocatalyst for HMF electrooxidation. The Mn‐doped Ni(OH)               2               nanosheets were synthesized through a microwave‐assisted deep eutectic solvent (DES) strategy, followed by an alkaline reflux process. The as synthesized Mn‐doped Ni(OH)               2               nanosheets demonstrated remarkable catalytic performance, achieving 100 % HMF conversion, 99.0 % FDCA yield, and 98.8 % Faraday efficiency. Analysis using X‐ray photoelectron spectroscopy (XPS), open circuit potential (OCP), and density functional theory (DFT) revealed that Mn doping induced surface charge redistribution and electron hole formation, enhancing HMF adsorption and facilitating its oxidation. This study not only elucidates the role of Mn doping in Ni(OH)               2               catalyst for HMF electrooxidation but also introduces an efficient electrocatalyst for biomass conversion.","2025-05-15","2026-01-05 13:19:36","2026-01-08 03:58:06","2026-01-08 03:17:39","e202401753","","10","20","","Chemistry  An Asian Journal","","","","","","","","en","","","","","DOI.org (Crossref)","","","","C:\Users\Administrator\Zotero\storage\2DK4YNWT\Xu 等 - 2025 - Mn‐Doped Ni(OH)2 Nanosheets as High‐Performance Electrocatalyst for 5‐Hydroxymethylfurfur.pdf","","","","","","","","","","","","","","","","","","","","","","","","","","","","","","","","","","","","","","","","","","","","","","","","",""
"PULZX96D","journalArticle","2022","Qi, Ji; An, Ziying; Chen, Xiao; Li, Chuang; Du, Yan; Zhang, Xiuhong; Liang, Changhai","Paired Electrolysis of Acrylonitrile and 5-Hydroxymethylfurfural for Simultaneous Generation of Adiponitrile and 2,5-Furandicarboxylic Acid","Catalysts","","2073-4344","10.3390/catal12070694","https://www.mdpi.com/2073-4344/12/7/694","The classic acrylonitrile (AN) electrohydrodimerization (EHD) to adiponitrile (ADN) process produces oxygen on the anode side. The oxygen evolution reaction (OER) is energy consuming, and O2 is of low value and has security issues while directly contacting with organic molecules. Herein, by replacing OER with 5-hydroxymethylfurfural oxidation reaction (HMFOR), we report paired electrolysis of AN and HMF for simultaneous generation of ADN and 2,5-furandicarboxylic acid (FDCA). On the anode side, the electrodeposited amorphous NiMoP film-covered nickel foam efficiently boosted HMFOR activity by enlarging the electrochemically active surface area (ECSA) via in situ selective removal of Mo and P on the surface. On the cathode side, addition of dimethylformamide (DMF) as a cosolvent enhanced the reaction efficiency of ANEHD by forming a single-phase electrolyte that offers better interaction between AN and the electrode. The ANEHD–HMFOR paired system shows excellent generation rates of FDCA (0.018 gFDCA·h−1·cm−2) and ADN (0.017 gADN·h−1·cm−2) at a high cell current (160 mA). An amount of 1 kWh of electricity can produce 2.91 mol of ADN and 0.53 mol of FDCA with 107.1% Faraday efficiency.","2022-06-24","2026-01-05 13:19:37","2026-01-08 03:58:06","2026-01-08 03:17:47","694","","7","12","","Catalysts","","","","","","","","en","","","","","DOI.org (Crossref)","","","","C:\Users\Administrator\Zotero\storage\IEP8LQD2\Qi 等 - 2022 - Paired Electrolysis of Acrylonitrile and 5-Hydroxymethylfurfural for Simultaneous Generation of Adip.pdf","","","","","","","","","","","","","","","","","","","","","","","","","","","","","","","","","","","","","","","","","","","","","","","","",""
"3MAAM4J3","journalArticle","2025","Li, Wen; Yin, Di; Liu, Wanxin; Li, Yi; Wu, Yijin","NiCo(OH)2/NiCo2O4 as a Heterogeneous Catalyst for the Electrooxidation of 5-Hydroxymethylfurfural","Inorganics","","2304-6740","10.3390/inorganics13070211","https://www.mdpi.com/2304-6740/13/7/211","The electrochemical oxidation of biomass-derived 5-hydroxymethylfurfural (HMF) coupled with water electrolysis for green hydrogen production is a promising strategy to address energy crises and environmental pollution. Despite the suitable adsorption energy for HMF due to their partially filled d-band electronic structures, Ni- or Co-based oxides/hydroxides still face challenges in insufficient activity and stability. In this study, a porous heterogeneous nickel cobalt oxide/hydroxide growth on nickel foam (NF), which is defined as NF@NiCo-H/O, was developed via immersion in concentrated alkali solution. Compared with the single-component NiCo oxides, the NF@NiCo-H/O catalyst exhibits a lower application potential of only 1.317 V, 1.395 V, and 1.443 V to achieve current densities of 20, 50, and 100 mA cm−2, respectively, in an alkaline solution containing HMF. Additionally, it demonstrates rapid reaction kinetics with a Tafel slope of 27.6 mV dec−1 and excellent cycling stability. Importantly, the presence of more high-valent Ni3+-O species on the catalyst surface contributes to its exceptional selectivity for 2,5-furandicarboxylic acid (86.7%), Faradaic efficiency (93.1%), and conversion rate (94.4%). This catalyst provides some theoretical guidance for the development of biomass electrooxidation catalysts for sustainable energy and chemical production.","2025-06-24","2026-01-05 13:19:42","2026-01-08 03:58:06","2026-01-08 03:17:52","211","","7","13","","Inorganics","","","","","","","","en","","","","","DOI.org (Crossref)","","","","C:\Users\Administrator\Zotero\storage\LYKKEC6Q\Li 等 - 2025 - NiCo(OH)2NiCo2O4 as a Heterogeneous Catalyst for the Electrooxidation of 5-Hydroxymethylfurfural.pdf","","","","","","","","","","","","","","","","","","","","","","","","","","","","","","","","","","","","","","","","","","","","","","","","",""
"QW3KMRZB","journalArticle","2025","Wang, Honglei; Wen, Xue; Dai, Jiuxiang; Xu, Dawei; Luo, Xianzhu; Luo, Pan; Cao, Hongshuai","High Oxidation State V‐O‐Co Structure Promotes the Role of V‐<sup>*</sup> O Intermediates in Efficient HMF Oxidation","Advanced Science","","2198-3844, 2198-3844","10.1002/advs.202508912","https://advanced.onlinelibrary.wiley.com/doi/10.1002/advs.202508912","Abstract                            Designing heterometallic oxygen‐bridge structure (M1‐O‐M2) to achieve the efficient and stable electrochemical conversion of 5‐hydroxymethylfurfural (HMF) to 2,5‐furandicarboxylic acid (FDCA) has become an important approach to address the rapid consumption of fossil fuels and mitigate white pollution. However, designing effective M1‐O‐M2 structures and elucidating their catalytic mechanisms remains a key challenge in this field. In this study, a high oxidation state V‐O‐Co structure is constructed by doping V into reconstructed CoOOH, which promotes the formation of the active intermediate V‐               *               O. The catalyst achieves a low HMF oxidation onset potential of 1.13 V vs. RHE, the HMF conversion rate reaches 99.6%, the FDCA selectivity reaches 97.8%, and the Faradaic efficiency reaches 97.0% at an applied potential of 1.30 V vs. RHE. Based on this novel design strategy, V‐doped Ni               2               P/NF is further constructed, which also forms the active intermediate V‐               *               O, validating the effectiveness of this strategy. Notably, the oxidation state‐controlled V‐O‐Co structure demonstrates excellent catalytic performance in promoting the efficient conversion of various organic compounds (such as glycerol, glucose, methanol, etc.) into high‐value chemicals, providing a precedent for the development of single hetero‐oxygen‐bridge structures for the effective conversion of various high‐value compounds.","2025-11","2026-01-05 13:19:43","2026-01-08 03:58:06","2026-01-08 03:18:00","e08912","","42","12","","Advanced Science","","","","","","","","en","","","","","DOI.org (Crossref)","","","","C:\Users\Administrator\Zotero\storage\9GJ55RFC\Wang 等 - 2025 - High Oxidation State V‐O‐Co Structure Promotes the Role of V‐ O Intermediates in Efficie.pdf","","","","","","","","","","","","","","","","","","","","","","","","","","","","","","","","","","","","","","","","","","","","","","","","",""
"TNVL38AS","journalArticle","2025","Ding, Ling; Shen, Zewen; Pan, Hao; Chen, Yana; Hu, Yezi; Zhao, Guixia; Hai, Guangtong; Huang, Xiubing","Regulating Intermediate Adsorption and Promoting Charge Transfer of CoCr‐LDHs by Ce Doping for Enhancing Electrooxidation of 5‐Hydroxymethylfurfural","Small","","1613-6810, 1613-6829","10.1002/smll.202409343","https://onlinelibrary.wiley.com/doi/10.1002/smll.202409343","Abstract                            Electrochemical oxidation of 5‐hydroxymethylfurfural (HMFOR) to generate high‐value chemicals under mild conditions acts as an energy‐saving and sustainable strategy. However, it is still challenging to develop electrocatalysts with high efficiency and good durability. Here, nickel foam (NF) supported CoCrCe(7.5%)‐LDH (layered double hydroxides) by doping Ce into CoCr‐LDH show high 5‐hydroxymethylfurfural (HMF) conversion (99%), 2,5‐furandicarboxylic acid (FDCA) yield (99%), and Faraday efficiency (100%) at 1.4 V               RHE               . The CoCrCe(7.5%)‐LDH also exhibits remarkable stability with 97% conversion of HMF after 10 cycles. The X‐ray absorption near‐edge spectroscopy (XANES) and theoretical calculation show that Ce doping into CoCr‐LDH is beneficial to the formation of high‐valance Co and significantly facilitates the electron transfer, regulates the adsorption behavior of intermediates, reduces the Gibbs free energy barrier and accelerates the reaction rate. This work promotes the use of rare earth elements as electrocatalysts to promote the oxidation of HMF.","2025-02","2026-01-05 13:19:44","2026-01-08 03:58:07","2026-01-08 03:18:08","2409343","","8","21","","Small","","","","","","","","en","","","","","DOI.org (Crossref)","","","","C:\Users\Administrator\Zotero\storage\W4FAD8CG\Ding 等 - 2025 - Regulating Intermediate Adsorption and Promoting Charge Transfer of CoCr‐LDHs by Ce Doping for Enhan.pdf","","","","","","","","","","","","","","","","","","","","","","","","","","","","","","","","","","","","","","","","","","","","","","","","",""
"6P8EHCR4","journalArticle","2025","Liu, Xupo; Zhang, Jingru; Chen, Ye; Wang, Gongke; Qiu, Jiayao; Sha, Xiaokang; Liu, Yi; Chang, Meinan; Guo, Junpo; Wang, Deli","Hydrogen Bridge‐Mediated Efficient Electrooxidation of 5‐Hydroxymethylfurfural on Ni(OH)<sub>2</sub> ─PO<sub>4</sub><sup>3−</sup> /Ni<sub>3</sub> (PO<sub>4</sub> )<sub>2</sub> Heterojunctions","Angewandte Chemie","","0044-8249, 1521-3757","10.1002/ange.202509274","https://onlinelibrary.wiley.com/doi/10.1002/ange.202509274","Abstract                            Accelerating proton deintercalation and transfer on the catalyst surface is crucial for the electrochemical oxidation of 5‐hydroxymethylfurfural (HMF) into the high‐value 2,5‐furanodicarboxylic acid (FDCA). Herein, we have constructed a Ni(OH)               2               ─PO               4               3−               /Ni               3               (PO               4               )               2               heterojunction catalyst that demonstrates exceptional selectivity (97.16%), yield (94.16%), and Faraday efficiency (94.31%) in the selective oxidation of HMF toward FDCA. The incorporation of PO               4               3−               groups triggers the formation of hydrogen bridges and reconfigures the interfacial charge distribution, facilitating the activation and subsequent proton deintercalation of lattice‐hydroxyl‐groups to generate active Ni               3+               ─O catalytic sites (PO               4               3−               ⋯H─O─Ni               2+               → HPO               4               2−               + Ni               3+               ─O). Both density functional theory calculations and pH‐dependent experiments emphasize the crucial function of these hydrogen bridges as proton ferries, effectively boosting the proton transfer efficiency during HMF oxidation. Theoretical studies unveil that the rate‐controlling step for OH adsorption on Ni(OH)               2               ─PO               4               3−               occurs via the hydrogen bridge connecting the PO               4               3−               group with the α‐C atom in *HMF‐H intermediate (PO               4               3−               ⋯H─O⋯COR → PO               4               2−               ─H⋯O─COR), significantly reducing the energy barrier for HMF oxidation. This study introduces a novel hydrogen bridge‐mediated electrooxidation mechanism that holds great potential for advancing biomass conversion technologies.","2025-10-13","2026-01-05 13:19:46","2026-01-08 03:58:07","2026-01-08 03:18:16","e202509274","","42","137","","Angewandte Chemie","","","","","","","","en","","","","","DOI.org (Crossref)","","","","C:\Users\Administrator\Zotero\storage\JFHWFIXN\Liu 等 - 2025 - Hydrogen Bridge‐Mediated Efficient Electrooxidation of 5‐Hydroxymethylfurfural on Ni(OH)2.pdf","","","","","","","","","","","","","","","","","","","","","","","","","","","","","","","","","","","","","","","","","","","","","","","","",""
"5Q4FNYWB","journalArticle","2025","Zhou, Peiyun; Liu, Xiang; Chen, Zhuo; Tang, Cheng; Zhao, Xikang; Zheng, Jinyu; Ge, Ruixiang; Duan, Haohong","Efficient Electrooxidation of 5‐Hydroxymethylfurfural to 2,5‐Furandicarboxylic Acid in a Weak Alkaline Medium Enabled by Interfacial OH<sup>−</sup> Enrichment","Advanced Functional Materials","","1616-301X, 1616-3028","10.1002/adfm.202502081","https://advanced.onlinelibrary.wiley.com/doi/10.1002/adfm.202502081","Abstract                            Developing electrooxidation of 5‐hydroxymethylfurfural (HMF) to 2,5‐furandicarboxylic acid (FDCA) in a weak alkaline medium can potentially inhibit HMF degradation to humins and thus mitigate carbon loss that is encountered in strong alkaline media; however, the activity is often compromised under low OH               −               concentration. Herein, by incorporating chromium oxide (CrO                                x                              ) as a hard Lewis acid onto CoO                                x                              surface (CoO                                x                              –CrO                                x                              ), HMF electrooxidation activity is largely boosted in a 1                m               carbonate buffer (pH 11), including higher FDCA Faradaic efficiency (from 41% to 90%), selectivity (from 33% to 92%), and yield (from 28% to 89%). The electrolysis under the weak alkaline medium can tolerate high HMF initial concentration (100 m               m               ), showing higher carbon balance (97%) compared with that in strong alkali (≈70%). Experimental data reveal that CrO                                x                              accelerates OH               −               migration from bulk to the electrode surface and enriches OH               −               at the electrode–electrolyte interface, enhancing catalyst reconstruction and reaction intermediate conversion, thus promoting the activity. Furthermore, the interfacial OH               −               enrichment strategy is demonstrated effective for other weak alkaline medium and for other biomass‐derived molecule (ethylene glycol and glycerol) electrooxidations. This work demonstrates that hard‐Lewis‐acid‐induced OH               −               enrichment dynamically optimizes interfacial microenvironment, establishing a new design principle for efficient electrocatalytic systems under weak alkaline conditions.","2025-08","2026-01-05 13:19:47","2026-01-08 03:58:07","2026-01-08 03:18:25","2502081","","35","35","","Adv Funct Materials","","","","","","","","en","","","","","DOI.org (Crossref)","","","","C:\Users\Administrator\Zotero\storage\RHFPE24X\Zhou 等 - 2025 - Efficient Electrooxidation of 5‐Hydroxymethylfurfural to 2,5‐Furandicarboxylic Acid in a Weak Alkali.pdf","","","","","","","","","","","","","","","","","","","","","","","","","","","","","","","","","","","","","","","","","","","","","","","","",""
